File,File_gb,Title,Genre,TMDB ID,Year,Length,TMDB Link,Description,Rating,Toloka Link,Rutracker Link,Poster,Trailer
G:/Movies\2021\Oxygene (2021).avi,1.45,Oxygen,"['Science Fiction', 'Thriller', 'Horror']",471498,2021,100,https://www.themoviedb.org/movie/471498,"A woman wakes in a cryogenic chamber with no recollection of how she got there, and must find a way out before running out of air.",6.622,https://toloka.to/tracker.php?nm=Oxygen,https://rutracker.org/forum/tracker.php?nm=Oxygen,https://image.tmdb.org/t/p/w200/u74DFoZGTcZ8cuHO8nvQkCqXEVP.jpg,https://www.youtube.com/watch?v=8IqXgZd-P98
G:/Movies\2021\Oxygène (2021).mkv,8.98,Oxygen,"['Science Fiction', 'Thriller', 'Horror']",471498,2021,100,https://www.themoviedb.org/movie/471498,"A woman wakes in a cryogenic chamber with no recollection of how she got there, and must find a way out before running out of air.",6.622,https://toloka.to/tracker.php?nm=Oxygen,https://rutracker.org/forum/tracker.php?nm=Oxygen,https://image.tmdb.org/t/p/w200/u74DFoZGTcZ8cuHO8nvQkCqXEVP.jpg,https://www.youtube.com/watch?v=8IqXgZd-P98
G:/Movies\2021\Power Of The Dog (2021).mkv,6.28,The Power of the Dog,"['Drama', 'Western']",600583,2021,126,https://www.themoviedb.org/movie/600583,"A domineering but charismatic rancher wages a war of intimidation on his brother's new wife and her teen son, until long-hidden secrets come to light.",6.786,https://toloka.to/tracker.php?nm=The Power of the Dog,https://rutracker.org/forum/tracker.php?nm=The Power of the Dog,https://image.tmdb.org/t/p/w200/kEy48iCzGnp0ao1cZbNeWR6yIhC.jpg,https://www.youtube.com/watch?v=LRDPo0CHrko
G:/Movies\2021\Red Rocket (2021).avi,2.19,Red Rocket,"['Drama', 'Comedy']",763329,2021,130,https://www.themoviedb.org/movie/763329,"Finding himself down and out in Los Angeles, ex porn star Mikey Saber decides to crawl back to his hometown of Texas City, Texas, where his estranged wife and mother-in-law are living. Just as this dysfunctional family seems to be making things work, Mikey meets a young woman named Strawberry working the cash register at a local doughnut shop.",6.778,https://toloka.to/tracker.php?nm=Red Rocket,https://rutracker.org/forum/tracker.php?nm=Red Rocket,https://image.tmdb.org/t/p/w200/345gLhiNpItU1ICx8OxJQwjgPmH.jpg,https://www.youtube.com/watch?v=Wfndmy-6e28
G:/Movies\2021\South Of Heaven (2021).mkv,2.42,South of Heaven,"['Crime', 'Drama', 'Thriller']",645861,2021,120,https://www.themoviedb.org/movie/645861,"Convicted felon Jimmy gets early parole after serving twelve years for armed robbery. Upon his release, he vows to give Annie, his childhood love, now dying from cancer, the best last year of her life – unfortunately it’s not that simple.",6.5,https://toloka.to/tracker.php?nm=South of Heaven,https://rutracker.org/forum/tracker.php?nm=South of Heaven,https://image.tmdb.org/t/p/w200/xtKnCL8SjGQeMDNJEE4BPMR89wD.jpg,https://www.youtube.com/watch?v=nBFlIvCJTo8
G:/Movies\2021\Stillwater (2021).mkv,2.91,Stillwater,"['Drama', 'Crime', 'Thriller']",616651,2021,139,https://www.themoviedb.org/movie/616651,"Bill Baker, an American oil-rig roughneck from Oklahoma, travels to Marseille to visit his estranged daughter, Allison, who is in prison for a murder she claims she did not commit. Confronted with language barriers, cultural differences, and a complicated legal system, Bill builds a new life for himself in France as he makes it his personal mission to exonerate his daughter.",6.639,https://toloka.to/tracker.php?nm=Stillwater,https://rutracker.org/forum/tracker.php?nm=Stillwater,https://image.tmdb.org/t/p/w200/cPdmPwcIcmu0ugfKcdFtI3vmOJq.jpg,https://www.youtube.com/watch?v=9cq1lPPeMUY
G:/Movies\2021\The Dig (2021).mkv,2.85,The Dig,"['Drama', 'History']",532865,2021,112,https://www.themoviedb.org/movie/532865,"As WWII looms, a wealthy widow hires an amateur archaeologist to excavate the burial mounds on her estate. When they make a historic discovery, the echoes of Britain's past resonate in the face of its uncertain future‎.",6.871,https://toloka.to/tracker.php?nm=The Dig,https://rutracker.org/forum/tracker.php?nm=The Dig,https://image.tmdb.org/t/p/w200/dFDNb9Gk1kyLRcconpj7Mc7C7IL.jpg,https://www.youtube.com/watch?v=JZQz0rkNajo
G:/Movies\2021\The Electrical Life Of Louis Wain (2021).mkv,6.42,The Electrical Life of Louis Wain,"['Drama', 'History', 'Comedy']",617762,2021,111,https://www.themoviedb.org/movie/617762,"The extraordinary true story of eccentric British artist Louis Wain, whose playful, sometimes even psychedelic pictures helped to transform the public's perception of cats forever.",6.9,https://toloka.to/tracker.php?nm=The Electrical Life of Louis Wain,https://rutracker.org/forum/tracker.php?nm=The Electrical Life of Louis Wain,https://image.tmdb.org/t/p/w200/xfP1vRNKvyOvWNjnd0o7kD6b2RR.jpg,https://www.youtube.com/watch?v=xzDr_tbL-es
G:/Movies\2021\The Hand Of God (2021).mkv,2.81,The Hand of God,['Drama'],722778,2021,130,https://www.themoviedb.org/movie/722778,"In 1980s Naples, Italy, an awkward Italian teen struggling to find his place experiences heartbreak and liberation after he's inadvertently saved from a freak accident by football legend Diego Maradona.",7.571,https://toloka.to/tracker.php?nm=The Hand of God,https://rutracker.org/forum/tracker.php?nm=The Hand of God,https://image.tmdb.org/t/p/w200/kreVxr5moB7K52IGGV1BGAn6nq1.jpg,https://www.youtube.com/watch?v=i_1VW_0i6vo
G:/Movies\2021\The Last Duel (2021).avi,3.46,The Last Duel,"['History', 'Drama', 'Action']",617653,2021,153,https://www.themoviedb.org/movie/617653,"King Charles VI declares that Knight Jean de Carrouges settle his dispute with his squire, Jacques Le Gris, by challenging him to a duel.",7.445,https://toloka.to/tracker.php?nm=The Last Duel,https://rutracker.org/forum/tracker.php?nm=The Last Duel,https://image.tmdb.org/t/p/w200/zjrJE0fpzPvX8saJXj8VNfcjBoU.jpg,https://www.youtube.com/watch?v=mgygUwPJvYk
G:/Movies\2021\The Tragedy Of Macbeth (2021).mkv,8.17,The Tragedy of Macbeth,"['Drama', 'War']",591538,2021,105,https://www.themoviedb.org/movie/591538,"Macbeth, the Thane of Glamis, receives a prophecy from a trio of witches that one day he will become King of Scotland. Consumed by ambition and spurred to action by his wife, Macbeth murders his king and takes the throne for himself.",6.954,https://toloka.to/tracker.php?nm=The Tragedy of Macbeth,https://rutracker.org/forum/tracker.php?nm=The Tragedy of Macbeth,https://image.tmdb.org/t/p/w200/tDNJEhcLbX3jIk3BMCur9pCdaVD.jpg,https://www.youtube.com/watch?v=ptqe7s6pO7g
G:/Movies\2021\The Unforgivable (2021).mkv,3.7,The Unforgivable,"['Drama', 'Crime']",645886,2021,112,https://www.themoviedb.org/movie/645886,A woman is released from prison after serving a sentence for a violent crime and re-enters a society that refuses to forgive her past.,7.445,https://toloka.to/tracker.php?nm=The Unforgivable,https://rutracker.org/forum/tracker.php?nm=The Unforgivable,https://image.tmdb.org/t/p/w200/1b3dNFDuE7i05TJlXrIC571yR01.jpg,https://www.youtube.com/watch?v=JNUjx7LZoiU
G:/Movies\2021\The White Tiger (2021).mkv,1.89,The White Tiger,['Drama'],628534,2021,125,https://www.themoviedb.org/movie/628534,An ambitious Indian driver uses his wit and cunning to escape from poverty and rise to the top. An epic journey based on the New York Times bestseller.,7.0,https://toloka.to/tracker.php?nm=The White Tiger,https://rutracker.org/forum/tracker.php?nm=The White Tiger,https://image.tmdb.org/t/p/w200/5JnmseS3DZ6ad2VMbrnbGCs8Rst.jpg,https://www.youtube.com/watch?v=35jJNyFuYKQ
G:/Movies\2021\Tick Tick Boom! (2021).mkv,6.74,"tick, tick... BOOM!","['Drama', 'Music']",537116,2021,115,https://www.themoviedb.org/movie/537116,"On the brink of turning 30, a promising theater composer navigates love, friendship and the pressure to create something great before time runs out.",7.7,"https://toloka.to/tracker.php?nm=tick, tick... BOOM!","https://rutracker.org/forum/tracker.php?nm=tick, tick... BOOM!",https://image.tmdb.org/t/p/w200/DPmfcuR8fh8ROYXgdjrAjSGA0o.jpg,https://www.youtube.com/watch?v=YJserno8tyU
G:/Movies\2021\Together (2021).mkv,4.77,Together,"['Drama', 'Comedy']",837548,2021,87,https://www.themoviedb.org/movie/837548,A husband and wife are forced to re-evaluate themselves and their relationship through the reality of the Covid-19 lockdown.,5.849,https://toloka.to/tracker.php?nm=Together,https://rutracker.org/forum/tracker.php?nm=Together,https://image.tmdb.org/t/p/w200/oeocQg0Bhmy0pqqRy50wEo0iwFB.jpg,https://www.youtube.com/watch?v=h-2I2VQrUqo
G:/Movies\UKR\Ya Pratsyuyu Na Tsvyntari (2021).mkv,3.99,I Work at the Cemetery,['Drama'],722071,2021,100,https://www.themoviedb.org/movie/722071,"Sasha manages a firm that installs tombstones at the local cemetery. His many customers have all experienced personal tragedies, but he is full of cynicism. One day, Sasha's 14-year-old daughter appears to bring him back into her life.",7.1,https://toloka.to/tracker.php?nm=I Work at the Cemetery,https://rutracker.org/forum/tracker.php?nm=I Work at the Cemetery,https://image.tmdb.org/t/p/w200/qBCihLSSnYnUZd4hFDmOhVoN8fD.jpg,N/A
G:/Movies\UKR\Обійми Мене (2021).mkv,0.64,Hold Me,['Drama'],828453,2021,24,https://www.themoviedb.org/movie/828453,"Worse than being lonely is to be lonely next to someone you love…  Waking up one morning, the young woman feels deep loneliness, which can only be dispelled by the embrace of her beloved husband. Not receiving it, she runs away from home for a day.  Leaving her own problem unspoken in front of the real-life dramas she wanders around the city ready to be embraced by any stranger she meets. That stranger turns out to be her ex-lover whom she hasn’t seen for a long time...",7.0,https://toloka.to/tracker.php?nm=Hold Me,https://rutracker.org/forum/tracker.php?nm=Hold Me,https://image.tmdb.org/t/p/w200/atECme6W5a3afQiiBVkxXV2JIIs.jpg,https://www.youtube.com/watch?v=480304581
Being The Ricardos (2021).mkv,1.51,Being the Ricardos,"['Drama', 'History']",517088,2021,132,https://www.themoviedb.org/movie/517088,Lucille Ball and Desi Arnaz face a crisis that could end their careers and another that could end their marriage.,6.541,https://toloka.to/tracker.php?nm=Being the Ricardos,https://rutracker.org/forum/tracker.php?nm=Being the Ricardos,https://image.tmdb.org/t/p/w200/oztBLWdRk5gApYmNdADXvXkLT5m.jpg,https://www.youtube.com/watch?v=WvrjCdtB0zM
No Sudden Move (2021).mkv,6.17,No Sudden Move,"['Crime', 'Drama', 'Mystery']",649409,2021,115,https://www.themoviedb.org/movie/649409,A group of criminals are brought together under mysterious circumstances and have to work together to uncover what's really going on when their simple job goes completely sideways.,6.383,https://toloka.to/tracker.php?nm=No Sudden Move,https://rutracker.org/forum/tracker.php?nm=No Sudden Move,https://image.tmdb.org/t/p/w200/34BmdJkdvRweC3xJJFlOFQ2IbYc.jpg,https://www.youtube.com/watch?v=kybqUuHscrM
G:/Movies\2022\A Man Called Otto (2022).mkv,3.15,A Man Called Otto,"['Comedy', 'Drama']",937278,2022,126,https://www.themoviedb.org/movie/937278,"When a lively young family moves in next door, grumpy widower Otto Anderson meets his match in a quick-witted, pregnant woman named Marisol, leading to an unlikely friendship that turns his world upside down.",7.757,https://toloka.to/tracker.php?nm=A Man Called Otto,https://rutracker.org/forum/tracker.php?nm=A Man Called Otto,https://image.tmdb.org/t/p/w200/130H1gap9lFfiTF9iDrqNIkFvC9.jpg,https://www.youtube.com/watch?v=XvbGalkHKPY
G:/Movies\2022\All Quiet On The Western Front (2022).mkv,2.51,All Quiet on the Western Front,"['Drama', 'War', 'Action']",49046,2022,147,https://www.themoviedb.org/movie/49046,"Paul Baumer and his friends Albert and Muller, egged on by romantic dreams of heroism, voluntarily enlist in the German army. Full of excitement and patriotic fervour, the boys enthusiastically march into a war they believe in. But once on the Western Front, they discover the soul-destroying horror of World War I.",7.737,https://toloka.to/tracker.php?nm=All Quiet on the Western Front,https://rutracker.org/forum/tracker.php?nm=All Quiet on the Western Front,https://image.tmdb.org/t/p/w200/2IRjbi9cADuDMKmHdLK7LaqQDKA.jpg,https://www.youtube.com/watch?v=hf8EYbVxtCY
G:/Movies\2022\Athena (2022).mkv,1.54,Athena,"['Action', 'Adventure', 'Thriller', 'Drama']",852046,2022,97,https://www.themoviedb.org/movie/852046,"Hours after the tragic death of their youngest brother in unexplained circumstances, three siblings have their lives thrown into chaos.",6.641,https://toloka.to/tracker.php?nm=Athena,https://rutracker.org/forum/tracker.php?nm=Athena,https://image.tmdb.org/t/p/w200/su9vjjdfrud65HDhgwF5JE59YWI.jpg,https://www.youtube.com/watch?v=vRunUkdkK8s
G:/Movies\2022\Barbarian (2022).mkv,5.24,Barbarian,"['Horror', 'Mystery', 'Thriller']",913290,2022,103,https://www.themoviedb.org/movie/913290,"In town for a job interview, a young woman arrives at her Airbnb late at night only to find that it has been mistakenly double-booked and a strange man is already staying there. Against her better judgement, she decides to stay the night anyway.",6.845,https://toloka.to/tracker.php?nm=Barbarian,https://rutracker.org/forum/tracker.php?nm=Barbarian,https://image.tmdb.org/t/p/w200/idT5mnqPcJgSkvpDX7pJffBzdVH.jpg,https://www.youtube.com/watch?v=Dr89pmKrqkI
G:/Movies\2022\Beast (2022).mkv,5.08,Beast,"['Thriller', 'Action', 'Horror']",760741,2022,93,https://www.themoviedb.org/movie/760741,"A recently widowed man and his two teenage daughters travel to a game reserve in South Africa. However, their journey of healing soon turns into a fight for survival when a bloodthirsty lion starts to stalk them.",6.638,https://toloka.to/tracker.php?nm=Beast,https://rutracker.org/forum/tracker.php?nm=Beast,https://image.tmdb.org/t/p/w200/iRV0IB5xQeOymuGGUBarTecQVAl.jpg,https://www.youtube.com/watch?v=oQMc7Sq36mI
G:/Movies\2022\Blonde (2022).mkv,2.66,Blonde,['Drama'],301502,2022,167,https://www.themoviedb.org/movie/301502,"From her volatile childhood as Norma Jeane, through her rise to stardom and romantic entanglements, this reimagined fictional portrait of Hollywood legend Marilyn Monroe blurs the lines of fact and fiction to explore the widening split between her public and private selves.",6.0,https://toloka.to/tracker.php?nm=Blonde,https://rutracker.org/forum/tracker.php?nm=Blonde,https://image.tmdb.org/t/p/w200/mEeHqtnWOR44vLCutEFku2WK6ou.jpg,https://www.youtube.com/watch?v=aIsFywuZPoQ
G:/Movies\2022\Bones And All (2022).mkv,6.63,Bones and All,"['Drama', 'Horror', 'Romance']",791177,2022,131,https://www.themoviedb.org/movie/791177,"Abandoned by her father, a young woman embarks on a thousand-mile odyssey through the backroads of America where she meets a disenfranchised drifter. But despite their best efforts, all roads lead back to their terrifying pasts and to a final stand that will determine whether their love can survive their otherness.",7.073,https://toloka.to/tracker.php?nm=Bones and All,https://rutracker.org/forum/tracker.php?nm=Bones and All,https://image.tmdb.org/t/p/w200/ayfr4iL0jVV9mquN7SKvjOidvRH.jpg,https://www.youtube.com/watch?v=0Nu7Z9AxGNg
G:/Movies\2022\Confess Fletch (2022).mkv,1.79,"Confess, Fletch","['Comedy', 'Mystery', 'Crime']",724665,2022,98,https://www.themoviedb.org/movie/724665,"The roguishly charming and endlessly troublesome Fletch becomes the prime suspect in a murder case while searching for a stolen art collection. The only way to prove his innocence? Find out which of the long list of suspects is the culprit - from the eccentric art dealer and a missing playboy to a crazy neighbor and Fletch’s Italian girlfriend. Crime, in fact, has never been this disorganized.",6.3,"https://toloka.to/tracker.php?nm=Confess, Fletch","https://rutracker.org/forum/tracker.php?nm=Confess, Fletch",https://image.tmdb.org/t/p/w200/h2oyiPu7aql1s1mLDoKBNAH7p3B.jpg,https://www.youtube.com/watch?v=pb2Pu5EjC1s
G:/Movies\2022\Devotion (2022).mkv,4.75,Devotion,"['War', 'Drama', 'Action']",653851,2022,139,https://www.themoviedb.org/movie/653851,The harrowing true story of two elite US Navy fighter pilots during the Korean War. Their heroic sacrifices would ultimately make them the Navy's most celebrated wingmen.,7.15,https://toloka.to/tracker.php?nm=Devotion,https://rutracker.org/forum/tracker.php?nm=Devotion,https://image.tmdb.org/t/p/w200/26yQPXymbWeCLKwcmyL8dRjAzth.jpg,https://www.youtube.com/watch?v=nIvBBd8pU1s
G:/Movies\2022\Dog (2022).mkv,10.55,Dog,"['Drama', 'Comedy']",626735,2022,101,https://www.themoviedb.org/movie/626735,An army ranger and his dog embark on a road trip along the Pacific Coast Highway to attend a friend's funeral.,7.328,https://toloka.to/tracker.php?nm=Dog,https://rutracker.org/forum/tracker.php?nm=Dog,https://image.tmdb.org/t/p/w200/zHQy4h36WwuCetKS7C3wcT1hkgA.jpg,https://www.youtube.com/watch?v=JL6p4IAI23Y
G:/Movies\2022\Elvis (2022).mkv,2.91,Elvis,"['Drama', 'Music', 'History']",614934,2022,159,https://www.themoviedb.org/movie/614934,"The life story of Elvis Presley as seen through the complicated relationship with his enigmatic manager, Colonel Tom Parker.",7.538,https://toloka.to/tracker.php?nm=Elvis,https://rutracker.org/forum/tracker.php?nm=Elvis,https://image.tmdb.org/t/p/w200/qBOKWqAFbveZ4ryjJJwbie6tXkQ.jpg,https://www.youtube.com/watch?v=ZbrmBotVIGw
G:/Movies\2022\Gold (2022).mkv,4.15,Gold,"['Adventure', 'Drama', 'Thriller']",334524,2022,121,https://www.themoviedb.org/movie/334524,"Kenny Wells, a modern-day prospector, hustler, and dreamer, is desperate for a lucky break. Left with few options, Wells teams up with an equally luckless geologist to execute a grandiose, last-ditch effort: to find gold deep in the uncharted jungle of Indonesia.",6.623,https://toloka.to/tracker.php?nm=Gold,https://rutracker.org/forum/tracker.php?nm=Gold,https://image.tmdb.org/t/p/w200/ukMXAdr325Tn1mLGkxdG8Lab16l.jpg,https://www.youtube.com/watch?v=VXSrDNFG8Xw
G:/Movies\2022\Hustle (2022).mkv,5.08,Hustle,"['Drama', 'Comedy']",705861,2022,117,https://www.themoviedb.org/movie/705861,"After discovering a once-in-a-lifetime player with a rocky past abroad, a down on his luck basketball scout takes it upon himself to bring the phenom to the States without his team's approval. Against the odds, they have one final shot to prove they have what it takes to make it in the NBA.",7.767,https://toloka.to/tracker.php?nm=Hustle,https://rutracker.org/forum/tracker.php?nm=Hustle,https://image.tmdb.org/t/p/w200/xWic7kPq13oRxYjbGLApXCnc7pz.jpg,https://www.youtube.com/watch?v=nM4iy0reaCA
G:/Movies\2022\Lamborghini The Man Behind The Legend (2022).mkv,5.31,Lamborghini: The Man Behind the Legend,"['Drama', 'History']",457232,2022,97,https://www.themoviedb.org/movie/457232,"Follow the launch of Lamborghini’s career as a manufacturer of tractors, a creator of military vehicles during World War II, and the designer of Lamborghini cars, which he launched in 1963 as the high-end sports car company Automobili Lamborghini.",6.5,https://toloka.to/tracker.php?nm=Lamborghini: The Man Behind the Legend,https://rutracker.org/forum/tracker.php?nm=Lamborghini: The Man Behind the Legend,https://image.tmdb.org/t/p/w200/RKgnYLhCNGCUkrhiCRrs40rEHe.jpg,https://www.youtube.com/watch?v=WjTICfrC25s
G:/Movies\2022\Maksym Osa (2022).mkv,13.67,Maksym Osa: The Gold of Werewolf,"['Mystery', 'History']",960668,2022,100,https://www.themoviedb.org/movie/960668,"Ukraine - 1636. Someone has attacked a battalion of cossacks that were transporting the gold of the Polish king. A cossack - Maksym Osa - tries to find the missing gold, but soon becomes one of the main suspects.",6.154,https://toloka.to/tracker.php?nm=Maksym Osa: The Gold of Werewolf,https://rutracker.org/forum/tracker.php?nm=Maksym Osa: The Gold of Werewolf,https://image.tmdb.org/t/p/w200/4U6cAUHxOD8YcoFheFPG5xqL0DR.jpg,N/A
G:/Movies\2022\Mascarade (2022).mkv,2.08,Masquerade,"['Comedy', 'Crime', 'Drama', 'Romance']",892515,2022,142,https://www.themoviedb.org/movie/892515,"Adrien, an attractive dancer whose career was shattered by a motorcycle accident, squanders his youth in idleness. His life changes when he meets Margot, who lives off scams and amorous manipulations.",6.858,https://toloka.to/tracker.php?nm=Masquerade,https://rutracker.org/forum/tracker.php?nm=Masquerade,https://image.tmdb.org/t/p/w200/31KgCTaOuLJsUm2cGN2OffripeD.jpg,https://www.youtube.com/watch?v=5g40qe8ABtw
G:/Movies\2022\Metal Lords (2022).mkv,2.03,Metal Lords,"['Comedy', 'Drama', 'Music']",739993,2022,97,https://www.themoviedb.org/movie/739993,"For teenage misfits Hunter and Kevin, the path to glory is clear: Devote themselves to metal. Win Battle of the Bands. And be worshipped like gods.",6.882,https://toloka.to/tracker.php?nm=Metal Lords,https://rutracker.org/forum/tracker.php?nm=Metal Lords,https://image.tmdb.org/t/p/w200/r97txZRmBb75SGsIAWqmplWJnO3.jpg,https://www.youtube.com/watch?v=TzAAtZx6xzk
G:/Movies\2022\No Exit (2022).avi,1.48,No Exit,"['Thriller', 'Mystery']",833425,2022,96,https://www.themoviedb.org/movie/833425,"Stranded at a rest stop in the mountains during a blizzard, a recovering addict discovers a kidnapped child hidden in a car belonging to one of the people inside the building which sets her on a terrifying struggle to identify who among them is the kidnapper.",6.898,https://toloka.to/tracker.php?nm=No Exit,https://rutracker.org/forum/tracker.php?nm=No Exit,https://image.tmdb.org/t/p/w200/5cnLoWq9o5tuLe1Zq4BTX4LwZ2B.jpg,https://www.youtube.com/watch?v=GFvupyiNEz0
G:/Movies\2022\Nope (2022).mkv,2.12,Nope,"['Horror', 'Science Fiction', 'Mystery']",762504,2022,130,https://www.themoviedb.org/movie/762504,"Residents in a lonely gulch of inland California bear witness to an uncanny, chilling discovery.",6.851,https://toloka.to/tracker.php?nm=Nope,https://rutracker.org/forum/tracker.php?nm=Nope,https://image.tmdb.org/t/p/w200/AcKVlWaNVVVFQwro3nLXqPljcYA.jpg,https://www.youtube.com/watch?v=fJKNxP-tjIQ
G:/Movies\2022\Paradise Highway (2022).mkv,2.37,Paradise Highway,"['Thriller', 'Crime', 'Drama']",939979,2022,115,https://www.themoviedb.org/movie/939979,"A truck driver has been forced to smuggle illicit cargo to save her brother from a deadly prison gang. With FBI operatives hot on her trail, Sally's conscience is challenged when the final package turns out to be a teenage girl.",5.927,https://toloka.to/tracker.php?nm=Paradise Highway,https://rutracker.org/forum/tracker.php?nm=Paradise Highway,https://image.tmdb.org/t/p/w200/2ahZgaFAbWoKMfJHhmhZDrdStgD.jpg,https://www.youtube.com/watch?v=wXp-lj9luJU
G:/Movies\2022\Prey (2022).mkv,2.8,Prey,"['Thriller', 'Action', 'Science Fiction']",766507,2022,100,https://www.themoviedb.org/movie/766507,"When danger threatens her camp, the fierce and highly skilled Comanche warrior Naru sets out to protect her people. But the prey she stalks turns out to be a highly evolved alien predator with a technically advanced arsenal.",7.718,https://toloka.to/tracker.php?nm=Prey,https://rutracker.org/forum/tracker.php?nm=Prey,https://image.tmdb.org/t/p/w200/ujr5pztc1oitbe7ViMUOilFaJ7s.jpg,https://www.youtube.com/watch?v=wZ7LytagKlc
G:/Movies\2022\Samaritan (2022).mkv,6.09,Samaritan,"['Science Fiction', 'Crime', 'Action']",629176,2022,102,https://www.themoviedb.org/movie/629176,"Thirteen year old Sam Cleary suspects that his mysteriously reclusive neighbor Mr. Smith is actually the legendary vigilante Samaritan, who was reported dead 25 years ago. With crime on the rise and the city on the brink of chaos, Sam makes it his mission to coax his neighbor out of hiding to save the city from ruin.",6.732,https://toloka.to/tracker.php?nm=Samaritan,https://rutracker.org/forum/tracker.php?nm=Samaritan,https://image.tmdb.org/t/p/w200/zgH8Ej50n2cvJCMJrxd4twEwSqz.jpg,https://www.youtube.com/watch?v=9FKnTxSC16E
G:/Movies\2022\Slumberland (2022).mkv,5.16,Slumberland,"['Family', 'Fantasy', 'Comedy']",668461,2022,117,https://www.themoviedb.org/movie/668461,"A young girl discovers a secret map to the dreamworld of Slumberland, and with the help of an eccentric outlaw, she traverses dreams and flees nightmares, with the hope that she will be able to see her late father again.",7.366,https://toloka.to/tracker.php?nm=Slumberland,https://rutracker.org/forum/tracker.php?nm=Slumberland,https://image.tmdb.org/t/p/w200/oGd2JUEtr0BZN3pK8yakmoZlVFq.jpg,https://www.youtube.com/watch?v=D7WhLZj5-LY
G:/Movies\2022\The Good Nurse (2022).mkv,2.38,The Good Nurse,"['Drama', 'Crime', 'Mystery']",541134,2022,121,https://www.themoviedb.org/movie/541134,"Suspicious that her colleague is responsible for a series of mysterious patient deaths, a nurse risks her own life to uncover the truth.",6.904,https://toloka.to/tracker.php?nm=The Good Nurse,https://rutracker.org/forum/tracker.php?nm=The Good Nurse,https://image.tmdb.org/t/p/w200/rSq6cq0LCcbro10jbEaPTEb3WmW.jpg,https://www.youtube.com/watch?v=e0DQevX-GZs
G:/Movies\2022\The Infernal Machine (2022).mkv,5.85,The Infernal Machine,"['Thriller', 'Mystery']",916605,2022,107,https://www.themoviedb.org/movie/916605,"Reclusive and controversial author Bruce Cogburn is drawn out of hiding by an obsessive fan, forcing the novelist to confront a past that he thought he could escape, and to account for events set in motion by his bestseller decades earlier. Cogburn's search for who is behind the manipulation and mental torment he encounters leads to an emotional roller-coaster ride full of fear and danger, where things are not always as clear as they seem to be, and where past deeds can have dire consequences.",6.3,https://toloka.to/tracker.php?nm=The Infernal Machine,https://rutracker.org/forum/tracker.php?nm=The Infernal Machine,https://image.tmdb.org/t/p/w200/bSqpOGzaKBdGkBLmcm1JJIVryYy.jpg,https://www.youtube.com/watch?v=q0vrecpxXZU
