File,File_gb,Title,Genre,TMDB ID,Year,Length,TMDB Link,Description,Rating,Toloka Link,Rutracker Link,Poster,Trailer
G:/Movies\2018\Blue Night (2018).mkv,1.4,The Tokyo Night Sky Is Always the Densest Shade of Blue,['Drama'],438339,2018,108,https://www.themoviedb.org/movie/438339,"Mika works as a nurse by day; by night she entertains covetous men at a girls' bar. Shinji is blind in one eye and ekes out a living as a construction worker. Young and grown-up at the same time, they both lead a lonely existence, but somehow their paths keep miraculously crossing under the Tokyo sky.",6.5,https://toloka.to/tracker.php?nm=The Tokyo Night Sky Is Always the Densest Shade of Blue,https://rutracker.org/forum/tracker.php?nm=The Tokyo Night Sky Is Always the Densest Shade of Blue,https://image.tmdb.org/t/p/w200/rG21rKfRLhJ8zsUQGCtvKMQwCT1.jpg,https://www.youtube.com/watch?v=8g-bF1ZDV-c
G:/Movies\2018\Burning (2018).mkv,1.81,Burning,['Documentary'],858058,2018,86,https://www.themoviedb.org/movie/858058,"Follows the deadly Australian bushfires of 2019-2020, known as ‘Black Summer’. Burning is an exploration of what happened as told from the perspective of victims of the fires, activists and scientists.",6.962,https://toloka.to/tracker.php?nm=Burning,https://rutracker.org/forum/tracker.php?nm=Burning,https://image.tmdb.org/t/p/w200/pdEgV6PckeiVcnComUw8bOirrpC.jpg,https://www.youtube.com/watch?v=hTfyD7ALJtU
G:/Movies\2018\Christopher Robin (2018).mkv,6.24,Christopher Robin,"['Adventure', 'Comedy', 'Family', 'Fantasy']",420814,2018,104,https://www.themoviedb.org/movie/420814,"Christopher Robin, the boy who had countless adventures in the Hundred Acre Wood, has grown up and lost his way. Now it’s up to his spirited and loveable stuffed animals, Winnie The Pooh, Tigger, Piglet, and the rest of the gang, to rekindle their friendship and remind him of endless days of childlike wonder and make-believe, when doing nothing was the very best something.",7.315,https://toloka.to/tracker.php?nm=Christopher Robin,https://rutracker.org/forum/tracker.php?nm=Christopher Robin,https://image.tmdb.org/t/p/w200/i6Ytex4d3CdfIKJFxB5v5vh24vb.jpg,https://www.youtube.com/watch?v=0URpDxIjZrQ
G:/Movies\2018\En Liberté! (2018).mkv,4.24,The Trouble with You,"['Comedy', 'Drama', 'Romance', 'Crime']",519106,2018,108,https://www.themoviedb.org/movie/519106,"Detective Yvonne is the widow of police chief Santi, a local hero in a town on the French Riviera. When she learns he was in fact a crooked cop, she tries to right his wrongs. Crossing paths with Antoine, a victim of Santi, sets off a series of wild events.",6.046,https://toloka.to/tracker.php?nm=The Trouble with You,https://rutracker.org/forum/tracker.php?nm=The Trouble with You,https://image.tmdb.org/t/p/w200/n8MFhzVkIYhsZYFgzJNnl2wDxmi.jpg,https://www.youtube.com/watch?v=cctKK23rr6Q
G:/Movies\2018\Entebbe (2018).mkv,4.4,7 Days in Entebbe,"['Thriller', 'Drama', 'Crime']",433627,2018,107,https://www.themoviedb.org/movie/433627,"In 1976, four hijackers take over an Air France airplane en route from Tel Aviv to Paris and force it to land in Entebbe, Uganda. With 248 passengers on board, one of the most daring rescue missions ever is set in motion.",5.834,https://toloka.to/tracker.php?nm=7 Days in Entebbe,https://rutracker.org/forum/tracker.php?nm=7 Days in Entebbe,https://image.tmdb.org/t/p/w200/nrC63ikbK4jDp3knvBqxPoWYEMM.jpg,https://www.youtube.com/watch?v=GXkGNZEikPU
G:/Movies\2018\Extinction (2018).mkv,2.66,Extinction,"['Action', 'Drama', 'Science Fiction', 'Thriller']",429415,2018,96,https://www.themoviedb.org/movie/429415,"A chief mechanic at a factory, haunted by apocalyptic nightmares, becomes a hero when Earth is invaded by a mysterious army bent on destruction.",6.312,https://toloka.to/tracker.php?nm=Extinction,https://rutracker.org/forum/tracker.php?nm=Extinction,https://image.tmdb.org/t/p/w200/qjnNdjrZIdi7d316SjjkgEjJRSg.jpg,https://www.youtube.com/watch?v=-ePDPGXkvlw
G:/Movies\2018\Galveston (2018).mkv,1.71,Galveston,['Thriller'],283601,2018,91,https://www.themoviedb.org/movie/283601,"After a violent encounter, Roy finds Rocky and sees something in her eyes that prompts a fateful decision. He takes her with him as he flees to Galveston, an action as ill-advised as it is inescapable.",6.08,https://toloka.to/tracker.php?nm=Galveston,https://rutracker.org/forum/tracker.php?nm=Galveston,https://image.tmdb.org/t/p/w200/q4oJPtd6ilux9NU9wXomTWBI90B.jpg,https://www.youtube.com/watch?v=82UWW1bJdl0
G:/Movies\2018\High Life (2018).mkv,5.94,High Life,"['Science Fiction', 'Drama', 'Mystery']",376865,2018,113,https://www.themoviedb.org/movie/376865,A father and his daughter struggle to survive in deep space where they live in isolation.,5.76,https://toloka.to/tracker.php?nm=High Life,https://rutracker.org/forum/tracker.php?nm=High Life,https://image.tmdb.org/t/p/w200/ftRRIYNzpTDYeTznrAxgT5v1vJY.jpg,https://www.youtube.com/watch?v=pyPPLC1Fqag
G:/Movies\2018\L'homme Fidele (2018).mkv,1.07,A Faithful Man,"['Comedy', 'Drama', 'Romance']",529784,2018,75,https://www.themoviedb.org/movie/529784,"Marianne leaves Abel for Paul, his best friend and the father of her unborn child. Eight years later, Paul dies and Marianne returns to Abel. However, things have changed for the both of them and feelings of jealousy surround their new relationship.",5.483,https://toloka.to/tracker.php?nm=A Faithful Man,https://rutracker.org/forum/tracker.php?nm=A Faithful Man,https://image.tmdb.org/t/p/w200/l1bHryDSFWgiDbEdTf2H7vQAKCp.jpg,https://www.youtube.com/watch?v=UDaYckxMgpM
G:/Movies\2018\Life Itself (2018).mkv,2.15,Life Itself,"['Drama', 'Romance']",446696,2018,118,https://www.themoviedb.org/movie/446696,"As a young New York couple goes from college romance to marriage and the birth of their first child, the unexpected twists of their journey create reverberations that echo over continents and through lifetimes.",7.225,https://toloka.to/tracker.php?nm=Life Itself,https://rutracker.org/forum/tracker.php?nm=Life Itself,https://image.tmdb.org/t/p/w200/pE2hxC8bPbIi9tGyhFg5xiFW6dA.jpg,https://www.youtube.com/watch?v=SOmGFWAMWh0
G:/Movies\2018\Mary Poppins Returns (2018).mkv,8.22,Mary Poppins Returns,"['Fantasy', 'Family', 'Comedy']",400650,2018,131,https://www.themoviedb.org/movie/400650,"Mary Poppins returns to the Banks family and helps them evade grave dangers by taking them on magical, musical adventures.",6.512,https://toloka.to/tracker.php?nm=Mary Poppins Returns,https://rutracker.org/forum/tracker.php?nm=Mary Poppins Returns,https://image.tmdb.org/t/p/w200/uTVGku4LibMGyKgQvjBtv3OYfAX.jpg,https://www.youtube.com/watch?v=-3jsfXDZLIY
G:/Movies\2018\Peppermint (2018).mkv,2.51,Peppermint,"['Action', 'Thriller']",458594,2018,102,https://www.themoviedb.org/movie/458594,"A grieving mother transforms herself into a vigilante following the murders of her husband and daughter, eluding the authorities to deliver her own personal brand of justice.",6.721,https://toloka.to/tracker.php?nm=Peppermint,https://rutracker.org/forum/tracker.php?nm=Peppermint,https://image.tmdb.org/t/p/w200/5SLjqWs4svPSAqRTH8woeEssivu.jpg,https://www.youtube.com/watch?v=sdL70wkf_H0
G:/Movies\2018\Peter Rabbit (2018).mkv,4.05,Peter Rabbit,"['Animation', 'Adventure', 'Family']",381719,2018,93,https://www.themoviedb.org/movie/381719,Peter Rabbit's feud with Mr. McGregor escalates to greater heights than ever before as they rival for the affections of the warm-hearted animal lover who lives next door.,6.685,https://toloka.to/tracker.php?nm=Peter Rabbit,https://rutracker.org/forum/tracker.php?nm=Peter Rabbit,https://image.tmdb.org/t/p/w200/lugOvdaNpbVGQK9TyMRDiUbLtY6.jpg,https://www.youtube.com/watch?v=3ittn4f0Em4
G:/Movies\2018\Ralph Breaks The Internet (2018).avi,1.51,Ralph Breaks the Internet,"['Family', 'Animation', 'Comedy', 'Adventure']",404368,2018,112,https://www.themoviedb.org/movie/404368,"Video game bad guy Ralph and fellow misfit Vanellope von Schweetz must risk it all by traveling to the World Wide Web in search of a replacement part to save Vanellope's video game, Sugar Rush. In way over their heads, Ralph and Vanellope rely on the citizens of the internet — the netizens — to help navigate their way, including an entrepreneur named Yesss, who is the head algorithm and the heart and soul of trend-making site BuzzzTube.",7.189,https://toloka.to/tracker.php?nm=Ralph Breaks the Internet,https://rutracker.org/forum/tracker.php?nm=Ralph Breaks the Internet,https://image.tmdb.org/t/p/w200/iVCrhBcpDaHGvv7CLYbK6PuXZo1.jpg,https://www.youtube.com/watch?v=T73h5bmD8Dc
G:/Movies\2018\Rampage (2018).mkv,4.31,Rampage,"['Action', 'Adventure', 'Science Fiction']",427641,2018,107,https://www.themoviedb.org/movie/427641,"Primatologist Davis Okoye shares an unshakable bond with George, the extraordinarily intelligent, silverback gorilla who has been in his care since birth.  But a rogue genetic experiment gone awry mutates this gentle ape into a raging creature of enormous size.  To make matters worse, it’s soon discovered there are other similarly altered animals.  As these newly created alpha predators tear across North America, destroying everything in their path, Okoye teams with a discredited genetic engineer to secure an antidote, fighting his way through an ever-changing battlefield, not only to halt a global catastrophe but to save the fearsome creature that was once his friend.",6.464,https://toloka.to/tracker.php?nm=Rampage,https://rutracker.org/forum/tracker.php?nm=Rampage,https://image.tmdb.org/t/p/w200/MGADip4thVSErP34FAAfzFBTZ5.jpg,https://www.youtube.com/watch?v=-nEB0oCwgxI
G:/Movies\2018\Solo A Star Wars Story (2018).mkv,4.85,Solo: A Star Wars Story,"['Science Fiction', 'Adventure', 'Action']",348350,2018,135,https://www.themoviedb.org/movie/348350,"Through a series of daring escapades deep within a dark and dangerous criminal underworld, Han Solo meets his mighty future copilot Chewbacca and encounters the notorious gambler Lando Calrissian.",6.563,https://toloka.to/tracker.php?nm=Solo: A Star Wars Story,https://rutracker.org/forum/tracker.php?nm=Solo: A Star Wars Story,https://image.tmdb.org/t/p/w200/4oD6VEccFkorEBTEDXtpLAaz0Rl.jpg,https://www.youtube.com/watch?v=jPEYpryMp2s
G:/Movies\2018\The Commuter (2018).mkv,6.51,The Commuter,"['Action', 'Thriller', 'Mystery']",399035,2018,104,https://www.themoviedb.org/movie/399035,"A businessman, on his daily commute home, gets unwittingly caught up in a criminal conspiracy that threatens not only his life but the lives of those around him.",6.361,https://toloka.to/tracker.php?nm=The Commuter,https://rutracker.org/forum/tracker.php?nm=The Commuter,https://image.tmdb.org/t/p/w200/rDeGK6FIUfVcXmuBdEORPAGPMNg.jpg,https://www.youtube.com/watch?v=g1RMoMrr3SM
G:/Movies\2018\The Con Is On (2018).mkv,5.04,The Con Is On,"['Comedy', 'Crime']",353576,2018,95,https://www.themoviedb.org/movie/353576,"In an effort to avoid paying off a massive gambling debt to a notorious mobster in England, a couple flees to Los Angeles and hatch a jewel theft plot.",4.0,https://toloka.to/tracker.php?nm=The Con Is On,https://rutracker.org/forum/tracker.php?nm=The Con Is On,https://image.tmdb.org/t/p/w200/d4ZzzFOokK356jf6L6vUp3RKNvM.jpg,https://www.youtube.com/watch?v=-3hucyd-s9U
G:/Movies\2018\The Favourite (2018).mkv,9.98,The Favourite,"['Drama', 'Comedy', 'Thriller', 'History']",375262,2018,119,https://www.themoviedb.org/movie/375262,"England, early 18th century. The close relationship between Queen Anne and Sarah Churchill is threatened by the arrival of Sarah's cousin, Abigail Hill, resulting in a bitter rivalry between the two cousins to be the Queen's favourite.",7.517,https://toloka.to/tracker.php?nm=The Favourite,https://rutracker.org/forum/tracker.php?nm=The Favourite,https://image.tmdb.org/t/p/w200/cwBq0onfmeilU5xgqNNjJAMPfpw.jpg,https://www.youtube.com/watch?v=SYb-wkehT1g
G:/Movies\2018\The Front Runner (2018).mkv,2.09,The Front Runner,"['Drama', 'History']",476764,2018,113,https://www.themoviedb.org/movie/476764,"Gary Hart, former Senator of Colorado, becomes the front-runner for the Democratic presidential nomination in 1987. Hart's intelligence, charisma and idealism makes him popular with young voters, leaving him with a seemingly clear path to the White House. All that comes crashing down when allegations of an extramarital affair surface in the media, forcing the candidate to address a scandal that threatens to derail his campaign and personal life.",5.9,https://toloka.to/tracker.php?nm=The Front Runner,https://rutracker.org/forum/tracker.php?nm=The Front Runner,https://image.tmdb.org/t/p/w200/9QKzd31H1bCjMAJ8HoaASWqbHfY.jpg,https://www.youtube.com/watch?v=BAOYDcnVx6E
G:/Movies\2018\The Mule (2018).mkv,6.22,The Mule,"['Crime', 'Drama']",504172,2018,116,https://www.themoviedb.org/movie/504172,"Earl Stone, a man in his eighties, is broke, alone, and facing foreclosure of his business when he is offered a job that simply requires him to drive. Easy enough, but, unbeknownst to Earl, he's just signed on as a drug courier for a Mexican cartel. He does so well that his cargo increases exponentially, and Earl hit the radar of hard-charging DEA agent Colin Bates.",6.846,https://toloka.to/tracker.php?nm=The Mule,https://rutracker.org/forum/tracker.php?nm=The Mule,https://image.tmdb.org/t/p/w200/oeZh7yEz3PMnZLgBPhrafFHRbVz.jpg,https://www.youtube.com/watch?v=0WhaleJ3Zik
G:/Movies\2018\The New Romantic (2018).mkv,2.84,The New Romantic,"['Drama', 'Comedy']",497864,2018,82,https://www.themoviedb.org/movie/497864,"In order to escape her looming post-graduation fate that includes student debt and zero romantic prospects, Blake Conway becomes a sugar baby. As the aspiring journalist and hopeless romantic documents the adventure, she sets out on a quest to figure out if society is right to judge these women and if her own self worth comes with a price.",6.3,https://toloka.to/tracker.php?nm=The New Romantic,https://rutracker.org/forum/tracker.php?nm=The New Romantic,https://image.tmdb.org/t/p/w200/qh6oz3RoKwTIqvcFLQ1dEqNWCCB.jpg,https://www.youtube.com/watch?v=9nwUFUOfigk
G:/Movies\2018\The Spy Who Dumped Me (2018).mkv,4.49,The Spy Who Dumped Me,"['Action', 'Comedy']",454992,2018,117,https://www.themoviedb.org/movie/454992,A couple of thirtysomething best friends unwittingly become entangled in an international conspiracy when one’s ex-boyfriend shows up at their apartment with a team of deadly assassins on his trail.,6.4,https://toloka.to/tracker.php?nm=The Spy Who Dumped Me,https://rutracker.org/forum/tracker.php?nm=The Spy Who Dumped Me,https://image.tmdb.org/t/p/w200/tpPERI5i6yjT73jYWyZ9iWltQ9L.jpg,https://www.youtube.com/watch?v=CXkUaaVrB_s
G:/Movies\2018\The Titan (2018).mkv,5.97,The Titan,"['Science Fiction', 'Thriller']",476926,2018,97,https://www.themoviedb.org/movie/476926,"On a bleak future Earth, a soldier endures a radical genetic transformation to save humanity. But his wife fears he's becoming more creature than man.",5.325,https://toloka.to/tracker.php?nm=The Titan,https://rutracker.org/forum/tracker.php?nm=The Titan,https://image.tmdb.org/t/p/w200/qRmQazyIBZR4pQIk9VruiZul0Au.jpg,https://www.youtube.com/watch?v=ctM8zpe3BHo
G:/Movies\2018\Vice (2018).mkv,6.44,Vice,"['Thriller', 'Science Fiction', 'Action', 'Adventure']",307663,2018,96,https://www.themoviedb.org/movie/307663,"Julian Michaels has designed the ultimate resort: VICE, where anything goes and the customers can play out their wildest fantasies with artificial inhabitants who look, think and feel like humans. When an artificial becomes self-aware and escapes, she finds herself caught in the crossfire between Julian's mercenaries and a cop who is hell-bent on shutting down Vice, and stopping the violence once and for all.",4.351,https://toloka.to/tracker.php?nm=Vice,https://rutracker.org/forum/tracker.php?nm=Vice,https://image.tmdb.org/t/p/w200/cBwZIq1QFasmsC9Wi3HvyEljfYN.jpg,https://www.youtube.com/watch?v=QxAoLvmH7gQ
G:/Movies\2018\Werk Ohne Autor (2018).mkv,9.36,Never Look Away,"['Drama', 'Romance', 'History']",423612,2018,189,https://www.themoviedb.org/movie/423612,"German artist Kurt Barnert has escaped East Germany and now lives in West Germany, but is tormented by his childhood under the Nazis and the GDR regime.",7.784,https://toloka.to/tracker.php?nm=Never Look Away,https://rutracker.org/forum/tracker.php?nm=Never Look Away,https://image.tmdb.org/t/p/w200/fn0Tp9SG0IQ3Nx8iHPYPiseLMWd.jpg,https://www.youtube.com/watch?v=gCEYXnDNcrg
G:/Movies\UKR\Svinhery (2018).mkv,3.68,Swingers,"['Comedy', 'Romance']",502913,2018,97,https://www.themoviedb.org/movie/502913,"Ihor, is bored with his glamorous girlfriend Ilona. Meanwhile, Irina, demands sex of Andrew, for which he has neither strength nor desire. Ihor and Irina demand a sexual experiment - a swinger's party. Meanwhile, Sveta, left naked on her lover's balcony when his wife suddenly returns, is saved by Denis the neighbour. But the evening gets more interesting when Edward appears on Denis's doorstep.",4.5,https://toloka.to/tracker.php?nm=Swingers,https://rutracker.org/forum/tracker.php?nm=Swingers,https://image.tmdb.org/t/p/w200/cAuGMebivsE25dRaUmo5bwf9SFs.jpg,N/A
G:/Movies\бачив\Fantastic Beasts. Collection (2016-2024) BDRip 1080p H.265 [UKR_ENG] [Hurtom]\Fantastic Beasts The Crimes Of Grindelwald (2018).mkv,7.04,Fantastic Beasts: The Crimes of Grindelwald,"['Fantasy', 'Adventure']",338952,2018,134,https://www.themoviedb.org/movie/338952,"Gellert Grindelwald has escaped imprisonment and has begun gathering followers to his cause—elevating wizards above all non-magical beings. The only one capable of putting a stop to him is the wizard he once called his closest friend, Albus Dumbledore. However, Dumbledore will need to seek help from the wizard who had thwarted Grindelwald once before, his former student Newt Scamander, who agrees to help, unaware of the dangers that lie ahead. Lines are drawn as love and loyalty are tested, even among the truest friends and family, in an increasingly divided wizarding world.",6.859,https://toloka.to/tracker.php?nm=Fantastic Beasts: The Crimes of Grindelwald,https://rutracker.org/forum/tracker.php?nm=Fantastic Beasts: The Crimes of Grindelwald,https://image.tmdb.org/t/p/w200/fMMrl8fD9gRCFJvsx0SuFwkEOop.jpg,https://www.youtube.com/watch?v=8bYBOVWLNIs
303 (2018).mkv,2.13,303,"['Romance', 'Drama', 'Comedy']",493900,2018,145,https://www.themoviedb.org/movie/493900,Two university students gain insight into life and love as they get to know each other during a road trip across Europe.,7.398,https://toloka.to/tracker.php?nm=303,https://rutracker.org/forum/tracker.php?nm=303,https://image.tmdb.org/t/p/w200/4GzC8xdGojbSabzsi2tm1TqEU8R.jpg,https://www.youtube.com/watch?v=YWJgJH5czm4
Andrew Bennett (2018).mkv,1.51,Andrew Bennett,['Fantasy'],1103508,2018,0,https://www.themoviedb.org/movie/1103508,"Andrew Bennett, a hunter of cursed books and banned grimoires, arrives in town after a series of violent murders that police cant solve. With Inspector Hobbs, Bennett pursues the brain that strives to achieve a magical ritual. Its dark outcome could be a disaster.",5.0,https://toloka.to/tracker.php?nm=Andrew Bennett,https://rutracker.org/forum/tracker.php?nm=Andrew Bennett,https://image.tmdb.org/t/p/w200/qs63UfbeTS5K2YLiu0pJbNsE9eY.jpg,N/A
Burning (2018).mkv,1.81,Burning,['Documentary'],858058,2018,86,https://www.themoviedb.org/movie/858058,"Follows the deadly Australian bushfires of 2019-2020, known as ‘Black Summer’. Burning is an exploration of what happened as told from the perspective of victims of the fires, activists and scientists.",6.962,https://toloka.to/tracker.php?nm=Burning,https://rutracker.org/forum/tracker.php?nm=Burning,https://image.tmdb.org/t/p/w200/pdEgV6PckeiVcnComUw8bOirrpC.jpg,https://www.youtube.com/watch?v=hTfyD7ALJtU
Capharnaüm (2018).mkv,2.3,Capernaum,['Drama'],517814,2018,126,https://www.themoviedb.org/movie/517814,"After running away from his negligent parents, committing a violent crime and being sentenced to five years in jail, a hardened, streetwise 12-year-old Lebanese boy sues his parents in protest of the life they have given him.",8.156,https://toloka.to/tracker.php?nm=Capernaum,https://rutracker.org/forum/tracker.php?nm=Capernaum,https://image.tmdb.org/t/p/w200/mFnfTVADj8yOxwzprYOmTPselk8.jpg,https://www.youtube.com/watch?v=maf0AbL3uEw
Madame Mills Une Voisine Si Parfaite (2018).mkv,1.47,"Mme Mills, une voisine si parfaite",['Comedy'],490422,2018,88,https://www.themoviedb.org/movie/490422,"Hélène leads a sad life as editor of cheesy romance novels. But one day, when the old and delightfully eccentric American Mrs. Mills moves into the apartment next door, there is a sudden return to her everyday life. The two unequal women make friends in a hurry and Mrs. Mills is finally even the new face for Hélènes publishing - and that brings great success. But actually the old lady pursues a completely different plan. And is she even a lady?",4.747,"https://toloka.to/tracker.php?nm=Mme Mills, une voisine si parfaite","https://rutracker.org/forum/tracker.php?nm=Mme Mills, une voisine si parfaite",https://image.tmdb.org/t/p/w200/oYqpw52dQknweVXSZqudqbkfn9v.jpg,N/A
Shoplifters (2018).mkv,2.2,Shoplifters,"['Drama', 'Crime', 'Thriller']",505192,2018,120,https://www.themoviedb.org/movie/505192,"After one of their shoplifting sessions, Osamu and his son come across a little girl in the freezing cold. At first reluctant to shelter the girl, Osamu’s wife agrees to take care of her after learning of the hardships she faces. Although the family is poor, barely making enough money to survive through petty crime, they seem to live happily together until an unforeseen incident reveals hidden secrets, testing the bonds that unite them.",7.855,https://toloka.to/tracker.php?nm=Shoplifters,https://rutracker.org/forum/tracker.php?nm=Shoplifters,https://image.tmdb.org/t/p/w200/4nfRUOv3LX5zLn98WS1WqVBk9E9.jpg,https://www.youtube.com/watch?v=wuaoRzuVqI0
Werk Ohne Autor (2018).mkv,9.36,Never Look Away,"['Drama', 'Romance', 'History']",423612,2018,189,https://www.themoviedb.org/movie/423612,"German artist Kurt Barnert has escaped East Germany and now lives in West Germany, but is tormented by his childhood under the Nazis and the GDR regime.",7.784,https://toloka.to/tracker.php?nm=Never Look Away,https://rutracker.org/forum/tracker.php?nm=Never Look Away,https://image.tmdb.org/t/p/w200/fn0Tp9SG0IQ3Nx8iHPYPiseLMWd.jpg,https://www.youtube.com/watch?v=gCEYXnDNcrg
G:/Movies\2019\Booksmart (2019).mkv,9.26,Booksmart,['Comedy'],505600,2019,102,https://www.themoviedb.org/movie/505600,"Two academic teenage superstars realize, on the eve of their high school graduation, that they should have worked less and played more. Determined to never fall short of their peers, the girls set out on a mission to cram four years of fun into one night.",7.033,https://toloka.to/tracker.php?nm=Booksmart,https://rutracker.org/forum/tracker.php?nm=Booksmart,https://image.tmdb.org/t/p/w200/micaVOa1UZsdzs4fKGA67ZMGOzc.jpg,https://www.youtube.com/watch?v=noAtmtxgJYw
G:/Movies\2019\Bruno (2019).mkv,1.29,Brüno,['Comedy'],18480,2019,83,https://www.themoviedb.org/movie/18480,Flamboyantly gay Austrian television reporter Bruno stirs up trouble with unsuspecting guests and large crowds through brutally frank interviews and painfully hilarious public displays of homosexuality.,5.623,https://toloka.to/tracker.php?nm=Brüno,https://rutracker.org/forum/tracker.php?nm=Brüno,https://image.tmdb.org/t/p/w200/wcUc7TYtsb72dHVb51sYaGIvQsr.jpg,https://www.youtube.com/watch?v=pxyJ_ZQVhTI
G:/Movies\2019\Luce (2019).mkv,7.06,Luce,"['Drama', 'Thriller']",492616,2019,109,https://www.themoviedb.org/movie/492616,"A star athlete and top student, Luce's idealized image is challenged by one of his teachers when his unsettling views on political violence come to light, putting a strain on family bonds while igniting intense debates on race and identity.",6.357,https://toloka.to/tracker.php?nm=Luce,https://rutracker.org/forum/tracker.php?nm=Luce,https://image.tmdb.org/t/p/w200/uxig1ZvVddzXVRYNOAQ6hKtea80.jpg,https://www.youtube.com/watch?v=aqzgDB1CMI4
G:/Movies\2019\Murder Mystery (2019).mkv,3.85,Murder Mystery,"['Action', 'Comedy', 'Mystery']",514999,2019,97,https://www.themoviedb.org/movie/514999,"On a long-awaited trip to Europe, a New York City cop and his hairdresser wife scramble to solve a baffling murder aboard a billionaire's yacht.",6.279,https://toloka.to/tracker.php?nm=Murder Mystery,https://rutracker.org/forum/tracker.php?nm=Murder Mystery,https://image.tmdb.org/t/p/w200/bSMSO9xupd4R4vwTPqigHn2quLN.jpg,https://www.youtube.com/watch?v=5YEVQDr2f3Q
G:/Movies\2019\Psychobitch (2019).mkv,1.92,Psychobitch,['Drama'],572292,2019,109,https://www.themoviedb.org/movie/572292,"Frida is different. Self chosen different. Marius, on the other hand is the most perfect boy in class, and likes to show off. When they have to work together at school, it's the start of a turbulent and challenging relationship. Generation Achievement meets impossible love.",6.638,https://toloka.to/tracker.php?nm=Psychobitch,https://rutracker.org/forum/tracker.php?nm=Psychobitch,https://image.tmdb.org/t/p/w200/9cZcWIEbmVgjqjeLsMDX5XplaUk.jpg,https://www.youtube.com/watch?v=ewukVKkmC1c
G:/Movies\2019\The Last Vermeer (2019).avi,1.46,The Last Vermeer,['Drama'],622977,2019,118,https://www.themoviedb.org/movie/622977,"A soldier and member of the Dutch resistance investigates stolen art in the wake of the Second World War, including a Vermeer sold to the Nazis by a flamboyant forger.",6.552,https://toloka.to/tracker.php?nm=The Last Vermeer,https://rutracker.org/forum/tracker.php?nm=The Last Vermeer,https://image.tmdb.org/t/p/w200/7CKxIyEIdHgkQzDixn68Hvwua90.jpg,https://www.youtube.com/watch?v=-0FU8z_1Arc
