File,File_gb,Title,Genre,TMDB ID,Year,Length,TMDB Link,Description,Rating,Toloka Link,Rutracker Link,Poster,Trailer
G:/Movies\бачив\Harry Potter\Harry Potter And The Deathly Hallows Part 2 (2011).mkv,6.87,Harry Potter and the Deathly Hallows: Part 2,"['Fantasy', 'Adventure']",12445,2011,130,https://www.themoviedb.org/movie/12445,"Harry, Ron and Hermione continue their quest to vanquish the evil Voldemort once and for all. Just as things begin to look hopeless for the young wizards, Harry discovers a trio of magical objects that endow him with powers to rival Voldemort's formidable skills.",8.097,https://toloka.to/tracker.php?nm=Harry Potter and the Deathly Hallows: Part 2,https://rutracker.org/forum/tracker.php?nm=Harry Potter and the Deathly Hallows: Part 2,https://image.tmdb.org/t/p/w200/c54HpQmuwXjHq2C9wmoACjxoom3.jpg,https://www.youtube.com/watch?v=5NYt1qirBWg
Jodaeiye Nader Az Simin (2011).avi,2.57,A Separation,['Drama'],60243,2011,123,https://www.themoviedb.org/movie/60243,A married couple are faced with a difficult decision - to improve the life of their child by moving to another country or to stay in Iran and look after a deteriorating parent who has Alzheimer's disease.,7.9,https://toloka.to/tracker.php?nm=A Separation,https://rutracker.org/forum/tracker.php?nm=A Separation,https://image.tmdb.org/t/p/w200/xQadpnoLokxzN3hRpCPbBGpxsiz.jpg,https://www.youtube.com/watch?v=58Onuy5USTc
G:/Movies\2012\Jagten (2012).mkv,5.89,The Hunt,['Drama'],103663,2012,116,https://www.themoviedb.org/movie/103663,"A teacher lives a lonely life, all the while struggling over his son’s custody. His life slowly gets better as he finds love and receives good news from his son, but his new luck is about to be brutally shattered by an innocent little lie.",8.102,https://toloka.to/tracker.php?nm=The Hunt,https://rutracker.org/forum/tracker.php?nm=The Hunt,https://image.tmdb.org/t/p/w200/jkixsXzRh28q3PCqFoWcf7unghT.jpg,https://www.youtube.com/watch?v=0KwzEQPMppI
G:/Movies\2012\Kosmopolis (2012).mkv,2.18,Cosmopolis,['Drama'],49014,2012,109,https://www.themoviedb.org/movie/49014,"Riding across Manhattan in a stretch limo during a riot in order to get a haircut, a 28-year-old billionaire asset manager's life begins to crumble.",5.727,https://toloka.to/tracker.php?nm=Cosmopolis,https://rutracker.org/forum/tracker.php?nm=Cosmopolis,https://image.tmdb.org/t/p/w200/94m7J9YeO0W7IEbfsOtFbweGgcu.jpg,https://www.youtube.com/watch?v=aKumKhV86hg
G:/Movies\2012\Lawless (2012).mkv,1.75,Lawless,"['Crime', 'Drama', 'Western']",82633,2012,115,https://www.themoviedb.org/movie/82633,"In 1931, the Bondurant brothers of Franklin County, Virginia, run a multipurpose backwoods establishment that hides their true business — bootlegging. Middle brother Forrest is the brain of the operation; older Howard is the brawn, and younger Jack, the lookout. Though the local police have taken bribes and left the brothers alone, a violent war erupts when a sadistic lawman from Chicago arrives and tries to shut down the Bondurants operation.",7.057,https://toloka.to/tracker.php?nm=Lawless,https://rutracker.org/forum/tracker.php?nm=Lawless,https://image.tmdb.org/t/p/w200/n4rFFZqnV9Lb4Kp3sSNIlD3K3fK.jpg,https://www.youtube.com/watch?v=HK-Q3wYsOgA
G:/Movies\2012\Mud (2012).mkv,8.95,Mud,['Drama'],103731,2012,130,https://www.themoviedb.org/movie/103731,Two boys find a fugitive hiding out on an island in the Mississippi River and form a pact to help him reunite with his lover and escape.,7.063,https://toloka.to/tracker.php?nm=Mud,https://rutracker.org/forum/tracker.php?nm=Mud,https://image.tmdb.org/t/p/w200/o2jT5jQdKh1HAF0fMKuGwBOwOYB.jpg,https://www.youtube.com/watch?v=DTEDfEhKwLo
G:/Movies\2012\The Master (2012).mkv,3.18,The Master,['Drama'],68722,2012,137,https://www.themoviedb.org/movie/68722,"Freddie, a volatile, heavy-drinking veteran who suffers from post-traumatic stress disorder, finds some semblance of a family when he stumbles onto the ship of Lancaster Dodd, the charismatic leader of a new ""religion"" he forms after World War II.",7.134,https://toloka.to/tracker.php?nm=The Master,https://rutracker.org/forum/tracker.php?nm=The Master,https://image.tmdb.org/t/p/w200/jjVGdNt4fYb3T2hjISGZ2qnCuaV.jpg,https://www.youtube.com/watch?v=RApl06pYIuU
G:/Movies\бачив\The Hobbit An Unexpected Journey (2012).mkv,14.71,The Hobbit: An Unexpected Journey,"['Adventure', 'Fantasy', 'Action']",49051,2012,169,https://www.themoviedb.org/movie/49051,"Bilbo Baggins, a hobbit enjoying his quiet life, is swept into an epic quest by Gandalf the Grey and thirteen dwarves who seek to reclaim their mountain home from Smaug, the dragon.",7.355,https://toloka.to/tracker.php?nm=The Hobbit: An Unexpected Journey,https://rutracker.org/forum/tracker.php?nm=The Hobbit: An Unexpected Journey,https://image.tmdb.org/t/p/w200/yHA9Fc37VmpUA5UncTxxo3rTGVA.jpg,https://www.youtube.com/watch?v=CXqZK-nbZ74
Frances Ha (2012).mkv,4.37,Frances Ha,"['Comedy', 'Drama']",121986,2012,86,https://www.themoviedb.org/movie/121986,"An aspiring dancer moves to New York City and becomes caught up in a whirlwind of flighty fair-weather friends, diminishing fortunes and career setbacks.",7.4,https://toloka.to/tracker.php?nm=Frances Ha,https://rutracker.org/forum/tracker.php?nm=Frances Ha,https://image.tmdb.org/t/p/w200/jrq1NoKvsxWCcffVOjegiYwloFN.jpg,https://www.youtube.com/watch?v=YdxCnCvCngk
Sexual Chronicles Of A French Family (2012).mkv,4.5,Sexual Chronicles of a French Family,"['Comedy', 'Drama', 'Romance']",112160,2012,85,https://www.themoviedb.org/movie/112160,Three generations of a French family open up about their sexual experiences and desires after young Romain is caught masturbating in his biology class.,5.315,https://toloka.to/tracker.php?nm=Sexual Chronicles of a French Family,https://rutracker.org/forum/tracker.php?nm=Sexual Chronicles of a French Family,https://image.tmdb.org/t/p/w200/qNc91oPy8ffEXOqLVwpegITC7Yd.jpg,https://www.youtube.com/watch?v=uZq9OfchXEE
G:/Movies\2013\12 Years A Slave (2013).mkv,3.12,12 Years a Slave,"['Drama', 'History']",76203,2013,134,https://www.themoviedb.org/movie/76203,"In the pre-Civil War United States, Solomon Northup, a free black man from upstate New York, is abducted and sold into slavery. Facing cruelty as well as unexpected kindnesses Solomon struggles not only to stay alive, but to retain his dignity. In the twelfth year of his unforgettable odyssey, Solomon’s chance meeting with a Canadian abolitionist will forever alter his life.",7.942,https://toloka.to/tracker.php?nm=12 Years a Slave,https://rutracker.org/forum/tracker.php?nm=12 Years a Slave,https://image.tmdb.org/t/p/w200/xdANQijuNrJaw1HA61rDccME4Tm.jpg,https://www.youtube.com/watch?v=z02Ie8wKKRg
G:/Movies\2013\Before Midnight (2013).mkv,5.31,Before Midnight,"['Romance', 'Drama']",132344,2013,109,https://www.themoviedb.org/movie/132344,"It has been nine years since we last met Jesse and Celine, the French-American couple who once met on a train in Vienna. They now live in Paris with twin daughters but have spent a summer in Greece at the invitation of an author colleague of Jesse's. When the vacation is over and Jesse must send his teenage son off to the States, he begins to question his life decisions, and his relationship with Celine is at risk.",7.5,https://toloka.to/tracker.php?nm=Before Midnight,https://rutracker.org/forum/tracker.php?nm=Before Midnight,https://image.tmdb.org/t/p/w200/qbGKJmNUroDz75kh5Oafoall89e.jpg,https://www.youtube.com/watch?v=NRVLVPWzeek
G:/Movies\2013\Enemy (2013).mkv,5.88,Enemy,"['Thriller', 'Mystery']",181886,2013,91,https://www.themoviedb.org/movie/181886,A mild-mannered college professor discovers a look-alike actor and delves into the other man's private affairs.,6.874,https://toloka.to/tracker.php?nm=Enemy,https://rutracker.org/forum/tracker.php?nm=Enemy,https://image.tmdb.org/t/p/w200/coJzyPTkSp4RMRGdgE7pXmJbCiG.jpg,https://www.youtube.com/watch?v=aVvgt3jIUsc
G:/Movies\2013\Filth (2013).mkv,5.46,Filth,"['Crime', 'Drama', 'Comedy']",85889,2013,97,https://www.themoviedb.org/movie/85889,A bigoted junkie cop suffering from borderline personality disorder and drug addiction manipulates and hallucinates his way through the festive season in a bid to secure promotion and win back his wife and daughter.,6.87,https://toloka.to/tracker.php?nm=Filth,https://rutracker.org/forum/tracker.php?nm=Filth,https://image.tmdb.org/t/p/w200/AeIodobH6Z8jvtHhqRSrqYrxGSo.jpg,https://www.youtube.com/watch?v=tymWDB7gtK4
G:/Movies\2013\Ida (2013).mkv,2.87,Ida,['Drama'],209274,2013,82,https://www.themoviedb.org/movie/209274,"Anna, a young novitiate in 1960s Poland, is on the verge of taking her vows when she discovers a family secret dating back to the years of the German occupation.",7.246,https://toloka.to/tracker.php?nm=Ida,https://rutracker.org/forum/tracker.php?nm=Ida,https://image.tmdb.org/t/p/w200/rQnBiFyHeSDxSaIgZpDaK52lflZ.jpg,https://www.youtube.com/watch?v=i_vrlpWB4Vo
G:/Movies\2013\Only Lovers Left Alive (2013).mkv,2.3,Only Lovers Left Alive,"['Drama', 'Romance']",152603,2013,123,https://www.themoviedb.org/movie/152603,"A depressed musician reunites with his lover in the desolate streets of Detroit. Though their romance has endured several centuries, it is tested by the arrival of her capricious and unpredictable younger sister.",7.2,https://toloka.to/tracker.php?nm=Only Lovers Left Alive,https://rutracker.org/forum/tracker.php?nm=Only Lovers Left Alive,https://image.tmdb.org/t/p/w200/6xY2MhYjFPb4xU3KlBJcFAJmMsF.jpg,https://www.youtube.com/watch?v=pkeWhokaPPs
G:/Movies\UKR\Креденс (2013).avi,1.35,Credenza,['Drama'],305257,2013,81,https://www.themoviedb.org/movie/305257,"Christmas Lviv. Cellist Orest is entangled in a chain of personal, domestic and work problems. And at some point it reaches the boiling point.",0.0,https://toloka.to/tracker.php?nm=Credenza,https://rutracker.org/forum/tracker.php?nm=Credenza,https://image.tmdb.org/t/p/w200/93VU7EdOw5BxvPL22gp2piIxEeG.jpg,https://www.youtube.com/watch?v=W_lALwc8S5w
G:/Movies\UKR\Такі Красиві Люди (2013).avi,1.45,Such Beautiful People,"['Drama', 'Romance']",548766,2013,94,https://www.themoviedb.org/movie/548766,"This gorgeous movie—artfully composed in a muted sandy palette with exquisite attention to visual detail—takes place on the shores of the Black Sea in Crimea, where a group of neighbors seek tranquility and fulfillment fishing and striving to live lives of meaning, outside the bustle and cynicism of city life. This is a film about universal themes of human interaction and love and explores the full range of human desires and relationships. Such Beautiful People is a gentle story of gentle people striving to make their lives better, to find true happiness, and to better understand one another. (via cinema.indiana.edu)",8.0,https://toloka.to/tracker.php?nm=Such Beautiful People,https://rutracker.org/forum/tracker.php?nm=Such Beautiful People,https://image.tmdb.org/t/p/w200/t0MJD6BPvH8OG9OUppJXLCNaKMa.jpg,N/A
G:/Movies\бачив\The Hobbit The Desolation Of Smaug (2013).mkv,14.72,The Hobbit: The Desolation of Smaug,"['Fantasy', 'Adventure', 'Action']",57158,2013,161,https://www.themoviedb.org/movie/57158,"The Dwarves, Bilbo and Gandalf have successfully escaped the Misty Mountains, and Bilbo has gained the One Ring. They all continue their journey to get their gold back from the Dragon, Smaug.",7.577,https://toloka.to/tracker.php?nm=The Hobbit: The Desolation of Smaug,https://rutracker.org/forum/tracker.php?nm=The Hobbit: The Desolation of Smaug,https://image.tmdb.org/t/p/w200/xQYiXsheRCDBA39DOrmaw1aSpbk.jpg,https://www.youtube.com/watch?v=gAo95e7_XKA
Only Lovers Left Alive (2013).mkv,2.3,Only Lovers Left Alive,"['Drama', 'Romance']",152603,2013,123,https://www.themoviedb.org/movie/152603,"A depressed musician reunites with his lover in the desolate streets of Detroit. Though their romance has endured several centuries, it is tested by the arrival of her capricious and unpredictable younger sister.",7.2,https://toloka.to/tracker.php?nm=Only Lovers Left Alive,https://rutracker.org/forum/tracker.php?nm=Only Lovers Left Alive,https://image.tmdb.org/t/p/w200/6xY2MhYjFPb4xU3KlBJcFAJmMsF.jpg,https://www.youtube.com/watch?v=pkeWhokaPPs
G:/Movies\2014\Get On Up (2014).mkv,2.91,Get on Up,"['Drama', 'Music']",239566,2014,139,https://www.themoviedb.org/movie/239566,A chronicle of James Brown's rise from extreme poverty to become one of the most influential musicians in history.,6.762,https://toloka.to/tracker.php?nm=Get on Up,https://rutracker.org/forum/tracker.php?nm=Get on Up,https://image.tmdb.org/t/p/w200/dVbGeU5agxFGcJnL5hk4uO8W7i2.jpg,https://www.youtube.com/watch?v=d9ELTgk6p54
G:/Movies\2014\Inherent Vice (2014).mkv,3.55,Inherent Vice,"['Drama', 'Mystery', 'Comedy']",171274,2014,149,https://www.themoviedb.org/movie/171274,"In Los Angeles at the turn of the 1970s, drug-fueled detective Larry ""Doc"" Sportello investigates the disappearance of an ex-girlfriend.",6.6,https://toloka.to/tracker.php?nm=Inherent Vice,https://rutracker.org/forum/tracker.php?nm=Inherent Vice,https://image.tmdb.org/t/p/w200/hyan5Uc0lGpPuad94DM1pLxneiP.jpg,https://www.youtube.com/watch?v=BTRMkQzFYHI
G:/Movies\2014\Nightcrawler (2014).mkv,2.98,Nightcrawler,"['Crime', 'Drama', 'Thriller']",242582,2014,118,https://www.themoviedb.org/movie/242582,"When Lou Bloom, desperate for work, muscles into the world of L.A. crime journalism, he blurs the line between observer and participant to become the star of his own story. Aiding him in his effort is Nina, a TV-news veteran.",7.7,https://toloka.to/tracker.php?nm=Nightcrawler,https://rutracker.org/forum/tracker.php?nm=Nightcrawler,https://image.tmdb.org/t/p/w200/j9HrX8f7GbZQm1BrBiR40uFQZSb.jpg,https://www.youtube.com/watch?v=7uaYhPpV7G4
G:/Movies\2014\The Interview (2014).mkv,2.19,The Interview,"['Action', 'Comedy']",228967,2014,113,https://www.themoviedb.org/movie/228967,"Dave Skylark and his producer Aaron Rapaport run the celebrity tabloid show ""Skylark Tonight"". When they land an interview with a surprise fan, North Korean dictator Kim Jong-un, they are recruited by the CIA to turn their trip to Pyongyang into an assassination mission.",6.2,https://toloka.to/tracker.php?nm=The Interview,https://rutracker.org/forum/tracker.php?nm=The Interview,https://image.tmdb.org/t/p/w200/tIDC4xT65l7a8qbgg8GvwD5g8c5.jpg,https://www.youtube.com/watch?v=BJu0KYd5-_M
G:/Movies\2014\Trash (2014).mkv,5.23,Trash,"['Adventure', 'Crime', 'Drama', 'Thriller']",206563,2014,112,https://www.themoviedb.org/movie/206563,"Set in Brazil, three kids who make a discovery in a garbage dump soon find themselves running from the cops and trying to right a terrible wrong.",7.1,https://toloka.to/tracker.php?nm=Trash,https://rutracker.org/forum/tracker.php?nm=Trash,https://image.tmdb.org/t/p/w200/kd4v23x0lalIRdwgLRkHgBhYBUQ.jpg,https://www.youtube.com/watch?v=VN08JrXZ9eM
G:/Movies\бачив\The Hobbit The Battle Of The Five Armies (2014).mkv,13.04,The Hobbit: The Battle of the Five Armies,"['Action', 'Adventure', 'Fantasy']",122917,2014,144,https://www.themoviedb.org/movie/122917,"Immediately after the events of The Desolation of Smaug, Bilbo and the dwarves try to defend Erebor's mountain of treasure from others who claim it: the men of the ruined Laketown and the elves of Mirkwood. Meanwhile an army of Orcs led by Azog the Defiler is marching on Erebor, fueled by the rise of the dark lord Sauron. Dwarves, elves and men must unite, and the hope for Middle-Earth falls into Bilbo's hands.",7.322,https://toloka.to/tracker.php?nm=The Hobbit: The Battle of the Five Armies,https://rutracker.org/forum/tracker.php?nm=The Hobbit: The Battle of the Five Armies,https://image.tmdb.org/t/p/w200/xT98tLqatZPQApyRmlPL12LtiWp.jpg,https://www.youtube.com/watch?v=Y6Fv5StfAxA
Timbuktu (2014).avi,1.47,Timbuktu,"['Drama', 'War']",265228,2014,96,https://www.themoviedb.org/movie/265228,"Just outside of the Malian city of Timbuktu, now occupied by militant Islamic rebels who impose the Sharia on civilians and inconvenience their daily life, a cattleman kills a fisherman.",6.978,https://toloka.to/tracker.php?nm=Timbuktu,https://rutracker.org/forum/tracker.php?nm=Timbuktu,https://image.tmdb.org/t/p/w200/tCpHpn8msgonS9HVDMkrcSZh4an.jpg,https://www.youtube.com/watch?v=k0yFA5qQ5cM
Zero Motivation (2014).avi,1.45,Zero Motivation,"['Drama', 'Comedy']",261825,2014,97,https://www.themoviedb.org/movie/261825,"Filmmaker Talya Lavie steps into the spotlight with a dark comedy about everyday life for a unit of young female Israeli soldiers. The human resources office at a remote desert base serves as the setting for this cast of characters, who bide their time pushing paper, battling for the top score in Minesweeper, and counting down the minutes until they can return to civilian life. Amidst their boredom and clashing personalities, issues of commitment—from friendship to love and country—are handled with humor and sharp-edged wit.",6.5,https://toloka.to/tracker.php?nm=Zero Motivation,https://rutracker.org/forum/tracker.php?nm=Zero Motivation,https://image.tmdb.org/t/p/w200/o47GwtgXRD6k8qxcJseQK2Fa9C0.jpg,https://www.youtube.com/watch?v=SV4ptfyaQFA
G:/Movies\2015\Black Mass (2015).mkv,2.24,Black Mass,"['Drama', 'Crime', 'History']",261023,2015,123,https://www.themoviedb.org/movie/261023,"The true story of Whitey Bulger, the brother of a state senator and the most infamous violent criminal in the history of South Boston, who became an FBI informant to take down a Mafia family invading his turf.",6.509,https://toloka.to/tracker.php?nm=Black Mass,https://rutracker.org/forum/tracker.php?nm=Black Mass,https://image.tmdb.org/t/p/w200/zfwciv4LIJkNQsfuhYGv0Nkiweg.jpg,https://www.youtube.com/watch?v=R_F-lVhSfx8
G:/Movies\2015\Crimson Peak (2015).mkv,4.77,Crimson Peak,"['Horror', 'Romance']",201085,2015,119,https://www.themoviedb.org/movie/201085,"In the aftermath of a family tragedy, an aspiring author is torn between love for her childhood friend and the temptation of a mysterious outsider. Trying to escape the ghosts of her past, she is swept away to a house that breathes, bleeds… and remembers.",6.651,https://toloka.to/tracker.php?nm=Crimson Peak,https://rutracker.org/forum/tracker.php?nm=Crimson Peak,https://image.tmdb.org/t/p/w200/f9TOb5anVwZeSbYjU1qNxPk3KUk.jpg,https://www.youtube.com/watch?v=oquZifON8Eg
G:/Movies\2015\Il Racconto Dei Racconti (2015).mkv,2.65,Tale of Tales,"['Romance', 'Fantasy', 'Horror']",314405,2015,134,https://www.themoviedb.org/movie/314405,The Queen of Selvascura risks everything to be a mother; the King of Roccaforte falls in love with the voice of a mysterious girl; the King of Altomonte becomes obsessed with a flea and neglects his daughter.,6.4,https://toloka.to/tracker.php?nm=Tale of Tales,https://rutracker.org/forum/tracker.php?nm=Tale of Tales,https://image.tmdb.org/t/p/w200/ryZsoaYmcEJsye6P5uo5thEjpqB.jpg,https://www.youtube.com/watch?v=Afup26-_3iw
G:/Movies\2015\Love (2015).mkv,4.95,Love,"['Drama', 'Science Fiction']",54320,2015,90,https://www.themoviedb.org/movie/54320,"After losing contact with Earth, Astronaut Lee Miller becomes stranded in orbit alone aboard the International Space Station. As time passes and life support systems dwindle, Lee battles to maintain his sanity - and simply stay alive. His world is a claustrophobic and lonely existence, until he makes a strange discovery aboard the ship.",5.4,https://toloka.to/tracker.php?nm=Love,https://rutracker.org/forum/tracker.php?nm=Love,https://image.tmdb.org/t/p/w200/AlhdDsLxSAb1a54rYLPb7CidAIX.jpg,https://www.youtube.com/watch?v=YiYmAixzpMg
G:/Movies\2015\Mia Madre (2015).mkv,1.26,Mia madre,['Drama'],315872,2015,106,https://www.themoviedb.org/movie/315872,"Margherita, a director in the middle of an existential crisis, has to deal with the inevitable and still unacceptable loss of her mother.",6.6,https://toloka.to/tracker.php?nm=Mia madre,https://rutracker.org/forum/tracker.php?nm=Mia madre,https://image.tmdb.org/t/p/w200/fkTsusFtFE5qvYkzFIben1aKsTn.jpg,https://www.youtube.com/watch?v=4U4zq2CAkc8
G:/Movies\2015\Queen Of The Desert (2015).mkv,1.91,Queen of the Desert,"['Drama', 'Adventure', 'History']",157843,2015,128,https://www.themoviedb.org/movie/157843,"A chronicle of Gertrude Bell's life, a traveler, writer, archaeologist, explorer, cartographer, and political attaché for the British Empire at the dawn of the twentieth century.",5.904,https://toloka.to/tracker.php?nm=Queen of the Desert,https://rutracker.org/forum/tracker.php?nm=Queen of the Desert,https://image.tmdb.org/t/p/w200/9WrxqWttzNiEgKGIm3mDteu6jmq.jpg,https://www.youtube.com/watch?v=SU-bdMPV0V4
G:/Movies\2015\Taxi (2015).mkv,0.96,Taxi,"['Action', 'Comedy', 'Crime', 'Adventure']",2330,2015,86,https://www.themoviedb.org/movie/2330,"In Marseilles (France), skilled pizza delivery boy Daniel who drives a scooter finally has his dreams come true. He gets a taxi license. Caught by the police for a huge speed infraction, he will help Emilien, a loser inspector who can't drive, on the track of German bank robbers, so he doesn't lose his license and his dream job.",6.702,https://toloka.to/tracker.php?nm=Taxi,https://rutracker.org/forum/tracker.php?nm=Taxi,https://image.tmdb.org/t/p/w200/egBxj3ude84theXc3cLbBHrWOkQ.jpg,https://www.youtube.com/watch?v=qYBNjVnbtFg
G:/Movies\2015\Trainwreck (2015).mkv,2.35,Trainwreck,"['Comedy', 'Romance']",271718,2015,125,https://www.themoviedb.org/movie/271718,"Having thought that monogamy was never possible, a commitment-phobic career woman may have to face her fears when she meets a good guy.",5.804,https://toloka.to/tracker.php?nm=Trainwreck,https://rutracker.org/forum/tracker.php?nm=Trainwreck,https://image.tmdb.org/t/p/w200/wrY629UTCUAKLJ4CxQXz6DCE7pr.jpg,https://www.youtube.com/watch?v=xETobANYaNc
G:/Movies\бачив\Macbeth (2015).mkv,1.96,Macbeth,['Drama'],27883,2015,107,https://www.themoviedb.org/movie/27883,A Scottish warlord and his wife murder their way to a pair of crowns.,7.303,https://toloka.to/tracker.php?nm=Macbeth,https://rutracker.org/forum/tracker.php?nm=Macbeth,https://image.tmdb.org/t/p/w200/4DbzuePqGcUY7olAKzGly7kCEmU.jpg,N/A
Carol (2015).mkv,8.66,Carol,"['Romance', 'Drama']",258480,2015,118,https://www.themoviedb.org/movie/258480,"In 1950s New York, a department-store clerk who dreams of a better life falls for an older, married woman.",7.486,https://toloka.to/tracker.php?nm=Carol,https://rutracker.org/forum/tracker.php?nm=Carol,https://image.tmdb.org/t/p/w200/cJeled7EyPdur6TnCA5GYg0UVna.jpg,https://www.youtube.com/watch?v=Y6ekAV16RIs
Secret In Their Eyes (2015).mkv,4.6,Secret in Their Eyes,"['Thriller', 'Mystery', 'Crime']",290751,2015,111,https://www.themoviedb.org/movie/290751,"A tight-knit team of FBI investigators, along with their District Attorney supervisor, is suddenly torn apart when they discover that one of their own teenage daughters has been brutally murdered.",6.371,https://toloka.to/tracker.php?nm=Secret in Their Eyes,https://rutracker.org/forum/tracker.php?nm=Secret in Their Eyes,https://image.tmdb.org/t/p/w200/gJl4iTxQlazkPCplGmSLGBUwqg9.jpg,https://www.youtube.com/watch?v=NODxOb3hgag
Spotlight (2015).mkv,2.85,Spotlight,"['Drama', 'History']",314365,2015,129,https://www.themoviedb.org/movie/314365,"The true story of how the Boston Globe uncovered the massive scandal of child molestation and cover-up within the local Catholic Archdiocese, shaking the entire Catholic Church to its core.",7.818,https://toloka.to/tracker.php?nm=Spotlight,https://rutracker.org/forum/tracker.php?nm=Spotlight,https://image.tmdb.org/t/p/w200/gWkgMnIsd8Od7iyhEEKL5G4Qq6J.jpg,https://www.youtube.com/watch?v=WgnrwwiIDlI
G:/Movies\2016\Demain Tout Commence (2016).mkv,3.59,Two Is a Family,"['Drama', 'Comedy']",382591,2016,118,https://www.themoviedb.org/movie/382591,A man without attachments or responsibilities suddenly finds himself with an abandoned baby and leaves for London to try and find the mother. Eight years later after he and his daughter become inseparable Gloria's mother reappears.,7.746,https://toloka.to/tracker.php?nm=Two Is a Family,https://rutracker.org/forum/tracker.php?nm=Two Is a Family,https://image.tmdb.org/t/p/w200/aFgtdhuzgI2eqnIVWtRB03x3pnt.jpg,https://www.youtube.com/watch?v=QrB7tmqWrAY
G:/Movies\2016\Our Kind Of Traitor (2016).mkv,4.28,Our Kind of Traitor,['Thriller'],205588,2016,108,https://www.themoviedb.org/movie/205588,"A young Oxford academic and his attorney girlfriend holiday in Morocco. They bump into a Russian millionaire who owns a peninsula and a diamond watch. He wants a game of tennis. What else he wants propels the lovers on a tortuous journey to the City of London and its unholy alliance with Britain's intelligence establishment, to Paris and the Alps.",6.0,https://toloka.to/tracker.php?nm=Our Kind of Traitor,https://rutracker.org/forum/tracker.php?nm=Our Kind of Traitor,https://image.tmdb.org/t/p/w200/t3BNaWimAZnZtSPGTsaqRrkc9lb.jpg,https://www.youtube.com/watch?v=N5k4FBGtbMs
G:/Movies\2016\The Light Between Oceans (2016).mkv,12.59,The Light Between Oceans,"['Drama', 'Romance']",283552,2016,133,https://www.themoviedb.org/movie/283552,A lighthouse keeper and his wife living off the coast of Western Australia raise a baby they rescue from an adrift rowboat.,7.078,https://toloka.to/tracker.php?nm=The Light Between Oceans,https://rutracker.org/forum/tracker.php?nm=The Light Between Oceans,https://image.tmdb.org/t/p/w200/c9S6VKZPllNgdxBUuI3GYJiqcKO.jpg,https://www.youtube.com/watch?v=w51IR_BFGyc
